{
  "contract_version": "receiving-evidence/0.2",
  "stage": "receiving",
  "record_id": "RCV-EV15",
  "unit_id": "EV15",
  "org_id": "org_eval",
  "status": "complete",
  "overall": "EXCEPTION",
  "expected": {
    "unit_id": "EV15",
    "org_id": "org_eval",
    "po_number": "PO-EVAL",
    "po_line": 1,
    "supplier": "Eval set",
    "sku": "SKU-BLANKET-RED",
    "asin": "n/a",
    "product_title": "Wool Blanket",
    "spec_colour": "red",
    "spec_variant": "queen",
    "spec_components": [
      "blanket"
    ],
    "cartons_ordered": 1,
    "units_per_carton_ordered": 1,
    "qty_ordered": 1
  },
  "summary": {
    "cartons_received": 1,
    "units_per_carton_counted": null,
    "qty_received": null,
    "identity_match": "uncertain",
    "carton_damage": "crushing;tears",
    "unit_damage": "uncertain",
    "quality_flags": []
  },
  "checks": [
    {
      "name": "identity",
      "expected": "SKU-BLANKET-RED · Wool Blanket",
      "verdict": "UNCERTAIN",
      "observed": "unclear",
      "source": "model",
      "photo_refs": [
        1
      ],
      "reason": "The model couldn't tell what the product is.",
      "confidence": null
    },
    {
      "name": "variant_colour",
      "expected": "red · queen",
      "verdict": "UNCERTAIN",
      "observed": "colour not seen · 01436",
      "source": "model",
      "photo_refs": [
        1
      ],
      "reason": "colour not determinable (seen: nothing); variant \"queen\" not confirmed by any label text.",
      "confidence": null
    },
    {
      "name": "carton_count",
      "expected": 1,
      "observed": 1,
      "source": "model",
      "photo_refs": [
        1
      ],
      "verdict": "PASS",
      "confidence": "low",
      "reason": "Photos show 1 cartons, 1 ordered. No operator count to cross-check."
    },
    {
      "name": "units_per_carton",
      "expected": 1,
      "observed": null,
      "source": "none",
      "photo_refs": [],
      "verdict": "UNCERTAIN",
      "reason": "No operator count and no reliable photo count for units per carton.",
      "confidence": null
    },
    {
      "name": "quantity",
      "expected": 1,
      "source": "derived",
      "photo_refs": [],
      "verdict": "UNCERTAIN",
      "observed": null,
      "reason": "Total can't be derived: carton count or units per carton is uncertain.",
      "confidence": null
    },
    {
      "name": "carton_damage",
      "expected": "none",
      "source": "model",
      "photo_refs": [
        1
      ],
      "verdict": "FAIL",
      "observed": [
        "crushing",
        "tears"
      ],
      "reason": "The carton is severely crushed, torn, and collapsed on one side.",
      "confidence": "medium"
    },
    {
      "name": "unit_damage",
      "expected": "none",
      "source": "model",
      "photo_refs": [],
      "verdict": "UNCERTAIN",
      "observed": null,
      "reason": "Units are inside a heavily damaged carton and cannot be clearly inspected.",
      "confidence": null
    },
    {
      "name": "components",
      "expected": [
        "blanket"
      ],
      "source": "model",
      "photo_refs": [
        1
      ],
      "observed": [],
      "verdict": "UNCERTAIN",
      "reason": "No unit is shown out of its packaging, so components can't be checked.",
      "confidence": null
    },
    {
      "name": "defects",
      "expected": "none",
      "verdict": "UNCERTAIN",
      "observed": "Defects cannot be determined as the product is obscured inside the damaged carton.",
      "source": "model",
      "photo_refs": [],
      "reason": "Defects cannot be determined as the product is obscured inside the damaged carton.",
      "confidence": null
    }
  ],
  "photos": [
    {
      "index": 1,
      "role": "carton",
      "ref": "eval/photos/nb13_box-ripped-open.jpg",
      "sha256": "36b96c30b247724134e061c0d26d5daf87ff0a272e315a6980f97fa1284e383e"
    }
  ],
  "operator_counts": {
    "cartons_received": null,
    "units_per_carton_counted": null
  },
  "operator_id": "eval",
  "captured_at": "2026-10-01T09:33:38.968Z",
  "model": {
    "provider": "gemini",
    "model": "gemini-3.5-flash-lite",
    "prompt_version": "rcv-prompt/0.2-blind",
    "latency_ms": 4183,
    "error": null,
    "raw_output": "{\n  \"photo_quality\": \"good\",\n  \"photo_quality_reason\": \"The photo is clear and well-lit, showing the carton and damage effectively.\",\n  \"product_type\": \"unclear\",\n  \"product_description\": \"Unclear due to severe carton damage obstructing the view of the contents.\",\n  \"product_photos\": [1],\n  \"colour_seen\": null,\n  \"label_text\": \"01436\",\n  \"cartons_visible\": 1,\n  \"cartons_fully_visible\": true,\n  \"units_in_open_carton\": null,\n  \"open_carton_fully_visible\": false,\n  \"count_photos\": [1],\n  \"carton_damage\": \"damaged\",\n  \"carton_damage_types\": [\n    \"crushing\",\n    \"tears\"\n  ],\n  \"carton_damage_reason\": \"The carton is severely crushed, torn, and collapsed on one side.\",\n  \"carton_damage_photos\": [1],\n  \"unit_damage\": \"unclear\",\n  \"unit_damage_types\": [],\n  \"unit_damage_reason\": \"Units are inside a heavily damaged carton and cannot be clearly inspected.\",\n  \"unit_damage_photos\": [],\n  \"opened_unit_visible\": false,\n  \"parts_seen\": [],\n  \"defect_present\": \"unclear\",\n  \"defect_description\": \"Defects cannot be determined as the product is obscured inside the damaged carton.\",\n  \"defect_photos\": []\n}"
  },
  "issues": [
    {
      "check": "carton_damage",
      "verdict": "FAIL",
      "detail": "The carton is severely crushed, torn, and collapsed on one side."
    },
    {
      "check": "identity",
      "verdict": "UNCERTAIN",
      "detail": "The model couldn't tell what the product is."
    },
    {
      "check": "variant_colour",
      "verdict": "UNCERTAIN",
      "detail": "colour not determinable (seen: nothing); variant \"queen\" not confirmed by any label text."
    },
    {
      "check": "units_per_carton",
      "verdict": "UNCERTAIN",
      "detail": "No operator count and no reliable photo count for units per carton."
    },
    {
      "check": "quantity",
      "verdict": "UNCERTAIN",
      "detail": "Total can't be derived: carton count or units per carton is uncertain."
    },
    {
      "check": "unit_damage",
      "verdict": "UNCERTAIN",
      "detail": "Units are inside a heavily damaged carton and cannot be clearly inspected."
    },
    {
      "check": "components",
      "verdict": "UNCERTAIN",
      "detail": "No unit is shown out of its packaging, so components can't be checked."
    },
    {
      "check": "defects",
      "verdict": "UNCERTAIN",
      "detail": "Defects cannot be determined as the product is obscured inside the damaged carton."
    }
  ],
  "content_hash": "b3f1caf962460476bd4d4a4ec3b2b17b392dd75a29dc29708b5a80346b0f1da5"
}