{
  "contract_version": "receiving-evidence/0.2",
  "stage": "receiving",
  "record_id": "RCV-EV10",
  "unit_id": "EV10",
  "org_id": "org_eval",
  "status": "complete",
  "overall": "EXCEPTION",
  "expected": {
    "unit_id": "EV10",
    "org_id": "org_eval",
    "po_number": "PO-EVAL",
    "po_line": 1,
    "supplier": "Eval set",
    "sku": "SKU-TOWEL-BLU",
    "asin": "n/a",
    "product_title": "Cotton Bath Towel",
    "spec_colour": "blue",
    "spec_variant": "bath",
    "spec_components": [
      "towel"
    ],
    "cartons_ordered": 1,
    "units_per_carton_ordered": 1,
    "qty_ordered": 1
  },
  "summary": {
    "cartons_received": 1,
    "units_per_carton_counted": null,
    "qty_received": null,
    "identity_match": "uncertain",
    "carton_damage": "crushing;water;tears",
    "unit_damage": "uncertain",
    "quality_flags": []
  },
  "checks": [
    {
      "name": "identity",
      "expected": "SKU-TOWEL-BLU · Cotton Bath Towel",
      "verdict": "UNCERTAIN",
      "observed": "unclear",
      "source": "model",
      "photo_refs": [],
      "reason": "The model couldn't tell what the product is.",
      "confidence": null
    },
    {
      "name": "variant_colour",
      "expected": "blue · bath",
      "verdict": "UNCERTAIN",
      "observed": "colour not seen · 170421 X12X12",
      "source": "model",
      "photo_refs": [],
      "reason": "colour not determinable (seen: nothing); variant \"bath\" not confirmed by any label text.",
      "confidence": null
    },
    {
      "name": "carton_count",
      "expected": 1,
      "observed": 1,
      "source": "model",
      "photo_refs": [
        1
      ],
      "verdict": "PASS",
      "confidence": "low",
      "reason": "Photos show 1 cartons, 1 ordered. No operator count to cross-check."
    },
    {
      "name": "units_per_carton",
      "expected": 1,
      "observed": null,
      "source": "none",
      "photo_refs": [],
      "verdict": "UNCERTAIN",
      "reason": "No operator count and no reliable photo count for units per carton.",
      "confidence": null
    },
    {
      "name": "quantity",
      "expected": 1,
      "source": "derived",
      "photo_refs": [],
      "verdict": "UNCERTAIN",
      "observed": null,
      "reason": "Total can't be derived: carton count or units per carton is uncertain.",
      "confidence": null
    },
    {
      "name": "carton_damage",
      "expected": "none",
      "source": "model",
      "photo_refs": [
        1
      ],
      "verdict": "FAIL",
      "observed": [
        "crushing",
        "water",
        "tears"
      ],
      "reason": "The carton shows severe crushing with a collapsed top and sides, water stains, and torn cardboard.",
      "confidence": "medium"
    },
    {
      "name": "unit_damage",
      "expected": "none",
      "source": "model",
      "photo_refs": [],
      "verdict": "UNCERTAIN",
      "observed": null,
      "reason": "The units are not visible inside the closed, damaged carton.",
      "confidence": null
    },
    {
      "name": "components",
      "expected": [
        "towel"
      ],
      "source": "model",
      "photo_refs": [],
      "observed": [],
      "verdict": "UNCERTAIN",
      "reason": "No unit is shown out of its packaging, so components can't be checked.",
      "confidence": null
    },
    {
      "name": "defects",
      "expected": "none",
      "verdict": "UNCERTAIN",
      "observed": "Cannot determine product defects as the product is not visible.",
      "source": "model",
      "photo_refs": [],
      "reason": "Cannot determine product defects as the product is not visible.",
      "confidence": null
    }
  ],
  "photos": [
    {
      "index": 1,
      "role": "carton",
      "ref": "eval/photos/nb07_box-water-stain-hole.jpg",
      "sha256": "13e7f736780193a0d4cdf6b9981f7ee3e67015a6e714071d5fa55403b3e0d38b"
    }
  ],
  "operator_counts": {
    "cartons_received": null,
    "units_per_carton_counted": null
  },
  "operator_id": "eval",
  "captured_at": "2026-10-01T09:32:40.267Z",
  "model": {
    "provider": "gemini",
    "model": "gemini-3.5-flash-lite",
    "prompt_version": "rcv-prompt/0.2-blind",
    "latency_ms": 4298,
    "error": null,
    "raw_output": "{\n  \"photo_quality\": \"good\",\n  \"photo_quality_reason\": \"The photo is clear and well lit, showing the carton from a top-down angle.\",\n  \"product_type\": \"unclear\",\n  \"product_description\": \"The product inside the carton is not visible.\",\n  \"product_photos\": [],\n  \"colour_seen\": null,\n  \"label_text\": \"170421 X12X12\",\n  \"cartons_visible\": 1,\n  \"cartons_fully_visible\": true,\n  \"units_in_open_carton\": null,\n  \"open_carton_fully_visible\": false,\n  \"count_photos\": [1],\n  \"carton_damage\": \"damaged\",\n  \"carton_damage_types\": [\n    \"crushing\",\n    \"water\",\n    \"tears\"\n  ],\n  \"carton_damage_reason\": \"The carton shows severe crushing with a collapsed top and sides, water stains, and torn cardboard.\",\n  \"carton_damage_photos\": [1],\n  \"unit_damage\": \"unclear\",\n  \"unit_damage_types\": [],\n  \"unit_damage_reason\": \"The units are not visible inside the closed, damaged carton.\",\n  \"unit_damage_photos\": [],\n  \"opened_unit_visible\": false,\n  \"parts_seen\": [],\n  \"defect_present\": \"unclear\",\n  \"defect_description\": \"Cannot determine product defects as the product is not visible.\",\n  \"defect_photos\": []\n}"
  },
  "issues": [
    {
      "check": "carton_damage",
      "verdict": "FAIL",
      "detail": "The carton shows severe crushing with a collapsed top and sides, water stains, and torn cardboard."
    },
    {
      "check": "identity",
      "verdict": "UNCERTAIN",
      "detail": "The model couldn't tell what the product is."
    },
    {
      "check": "variant_colour",
      "verdict": "UNCERTAIN",
      "detail": "colour not determinable (seen: nothing); variant \"bath\" not confirmed by any label text."
    },
    {
      "check": "units_per_carton",
      "verdict": "UNCERTAIN",
      "detail": "No operator count and no reliable photo count for units per carton."
    },
    {
      "check": "quantity",
      "verdict": "UNCERTAIN",
      "detail": "Total can't be derived: carton count or units per carton is uncertain."
    },
    {
      "check": "unit_damage",
      "verdict": "UNCERTAIN",
      "detail": "The units are not visible inside the closed, damaged carton."
    },
    {
      "check": "components",
      "verdict": "UNCERTAIN",
      "detail": "No unit is shown out of its packaging, so components can't be checked."
    },
    {
      "check": "defects",
      "verdict": "UNCERTAIN",
      "detail": "Cannot determine product defects as the product is not visible."
    }
  ],
  "content_hash": "ad0adfbaaae463d86fd2adb7cb2f021730f290689c8a6cb8edd8e83e198073dd"
}