{
  "contract_version": "receiving-evidence/0.2",
  "stage": "receiving",
  "record_id": "RCV-EV07",
  "unit_id": "EV07",
  "org_id": "org_eval",
  "status": "complete",
  "overall": "REVIEW",
  "expected": {
    "unit_id": "EV07",
    "org_id": "org_eval",
    "po_number": "PO-EVAL",
    "po_line": 1,
    "supplier": "Eval set",
    "sku": "SKU-CHARGER-20W",
    "asin": "n/a",
    "product_title": "Phone Charger 20W",
    "spec_colour": "n/a",
    "spec_variant": "20W",
    "spec_components": [
      "charger"
    ],
    "cartons_ordered": 1,
    "units_per_carton_ordered": 9,
    "qty_ordered": 9
  },
  "summary": {
    "cartons_received": 1,
    "units_per_carton_counted": 9,
    "qty_received": 9,
    "identity_match": "uncertain",
    "carton_damage": "none",
    "unit_damage": "none",
    "quality_flags": []
  },
  "checks": [
    {
      "name": "identity",
      "expected": "SKU-CHARGER-20W · Phone Charger 20W",
      "verdict": "UNCERTAIN",
      "observed": "small boxes",
      "source": "model",
      "photo_refs": [
        1
      ],
      "reason": "Only packaging was seen (\"small boxes\"); the product itself isn't visible and no label names it.",
      "confidence": null
    },
    {
      "name": "variant_colour",
      "expected": "20W",
      "verdict": "UNCERTAIN",
      "observed": "QTY 9",
      "source": "model",
      "photo_refs": [
        1
      ],
      "reason": "variant \"20W\" not confirmed by any label text.",
      "confidence": null
    },
    {
      "name": "carton_count",
      "expected": 1,
      "observed": 1,
      "source": "model",
      "photo_refs": [
        1
      ],
      "verdict": "PASS",
      "confidence": "low",
      "reason": "Photos show 1 cartons, 1 ordered. No operator count to cross-check."
    },
    {
      "name": "units_per_carton",
      "expected": 9,
      "observed": 9,
      "source": "model",
      "photo_refs": [
        1
      ],
      "verdict": "PASS",
      "confidence": "low",
      "reason": "Photos show 9 units per carton, 9 ordered. No operator count to cross-check."
    },
    {
      "name": "quantity",
      "expected": 9,
      "source": "derived",
      "photo_refs": [],
      "observed": 9,
      "verdict": "PASS",
      "reason": "1 cartons × 9 units = 9, 9 ordered. Assumes every carton holds the same count as the one that was opened.",
      "confidence": "low"
    },
    {
      "name": "carton_damage",
      "expected": "none",
      "source": "model",
      "photo_refs": [],
      "verdict": "PASS",
      "observed": "none",
      "reason": "No damage seen on the main cartons.",
      "confidence": "medium"
    },
    {
      "name": "unit_damage",
      "expected": "none",
      "source": "model",
      "photo_refs": [],
      "verdict": "PASS",
      "observed": "none",
      "reason": "No damage visible on the inner units.",
      "confidence": "medium"
    },
    {
      "name": "components",
      "expected": [
        "charger"
      ],
      "source": "model",
      "photo_refs": [
        1
      ],
      "observed": [],
      "verdict": "UNCERTAIN",
      "reason": "No unit is shown out of its packaging, so components can't be checked.",
      "confidence": null
    },
    {
      "name": "defects",
      "expected": "none",
      "verdict": "PASS",
      "observed": "none",
      "source": "model",
      "photo_refs": [],
      "reason": "No obvious defects observed.",
      "confidence": "medium"
    }
  ],
  "photos": [
    {
      "index": 1,
      "role": "carton",
      "ref": "eval/photos/nb05_qty9-open-carton.jpg",
      "sha256": "ac643c85327b9d57e722a6ba1aece5c9d72b584e78919f3d0718c11e1656be79"
    }
  ],
  "operator_counts": {
    "cartons_received": null,
    "units_per_carton_counted": null
  },
  "operator_id": "eval",
  "captured_at": "2026-10-01T09:52:38.183Z",
  "model": {
    "provider": "gemini",
    "model": "gemini-3.5-flash-lite",
    "prompt_version": "rcv-prompt/0.2-blind",
    "latency_ms": 3132,
    "error": null,
    "raw_output": "{\n  \"photo_quality\": \"good\",\n  \"photo_quality_reason\": \"The image is clear, well-lit, and shows the contents of the carton.\",\n  \"product_type\": \"small boxes\",\n  \"product_description\": \"Small cardboard boxes with barcodes inside a larger open carton labeled QTY 9.\",\n  \"product_photos\": [1],\n  \"colour_seen\": \"brown\",\n  \"label_text\": \"QTY 9\",\n  \"cartons_visible\": 1,\n  \"cartons_fully_visible\": true,\n  \"units_in_open_carton\": 9,\n  \"open_carton_fully_visible\": true,\n  \"count_photos\": [1],\n  \"carton_damage\": \"none\",\n  \"carton_damage_types\": [],\n  \"carton_damage_reason\": \"No damage seen on the main cartons.\",\n  \"carton_damage_photos\": [],\n  \"unit_damage\": \"none\",\n  \"unit_damage_types\": [],\n  \"unit_damage_reason\": \"No damage visible on the inner units.\",\n  \"unit_damage_photos\": [],\n  \"opened_unit_visible\": false,\n  \"parts_seen\": [],\n  \"defect_present\": \"no\",\n  \"defect_description\": \"No obvious defects observed.\",\n  \"defect_photos\": []\n}"
  },
  "issues": [
    {
      "check": "identity",
      "verdict": "UNCERTAIN",
      "detail": "Only packaging was seen (\"small boxes\"); the product itself isn't visible and no label names it."
    },
    {
      "check": "variant_colour",
      "verdict": "UNCERTAIN",
      "detail": "variant \"20W\" not confirmed by any label text."
    },
    {
      "check": "components",
      "verdict": "UNCERTAIN",
      "detail": "No unit is shown out of its packaging, so components can't be checked."
    }
  ],
  "content_hash": "6c608c44b00d547aa6c02a7abb89cea1e3ae81fa20e801be03dcaf3074b5eed0"
}